{
  "id": "119-hr-10092",
  "billType": "hr",
  "billNumber": 10092,
  "congress": 119,
  "title": "GATE Act of 2026",
  "status": "inCommittee",
  "chamber": "House",
  "policyArea": "Science, Technology, Communications",
  "sponsor": {
    "memberId": "H001101",
    "name": "Rep. Harrigan, Pat [R-NC-10]",
    "party": "R",
    "state": "NC",
    "district": "10",
    "chamber": "House"
  },
  "cosponsorCount": 0,
  "latestAction": {
    "date": "2026-08-13",
    "text": "Referred to the House Committee on Science, Space, and Technology.",
    "chamber": "House"
  },
  "actions": [
    {
      "date": "2026-08-13",
      "text": "Referred to the House Committee on Science, Space, and Technology.",
      "chamber": "House",
      "actionCode": "H11100"
    },
    {
      "date": "2026-08-13",
      "text": "Introduced in House",
      "chamber": "House",
      "actionCode": "Intro-H"
    },
    {
      "date": "2026-08-13",
      "text": "Introduced in House",
      "chamber": "House",
      "actionCode": "1000"
    }
  ],
  "textVersions": [
    {
      "type": "Introduced in House",
      "date": "2026-08-13",
      "url": "https://www.congress.gov/119/bills/hr10092/BILLS-119hr10092ih.htm"
    }
  ],
  "officialUrl": "https://www.congress.gov/bill/119th-congress/house-bill/10092",
  "updatedAt": "2026-08-25T16:37:19Z",
  "introducedAt": "2026-08-13"
}