{
  "id": "119-hr-10089",
  "billType": "hr",
  "billNumber": 10089,
  "congress": 119,
  "title": "Representation Act",
  "status": "inCommittee",
  "chamber": "House",
  "policyArea": "Government Operations and Politics",
  "sponsor": {
    "memberId": "G000607",
    "name": "Rep. Gallagher, James [R-CA-1]",
    "party": "R",
    "state": "CA",
    "district": "1",
    "chamber": "House"
  },
  "cosponsorCount": 1,
  "latestAction": {
    "date": "2026-08-13",
    "text": "Referred to the House Committee on the Judiciary.",
    "chamber": "House"
  },
  "actions": [
    {
      "date": "2026-08-13",
      "text": "Referred to the House Committee on the Judiciary.",
      "chamber": "House",
      "actionCode": "H11100"
    },
    {
      "date": "2026-08-13",
      "text": "Introduced in House",
      "chamber": "House",
      "actionCode": "Intro-H"
    },
    {
      "date": "2026-08-13",
      "text": "Introduced in House",
      "chamber": "House",
      "actionCode": "1000"
    }
  ],
  "textVersions": [
    {
      "type": "Introduced in House",
      "date": "2026-08-13",
      "url": "https://www.congress.gov/119/bills/hr10089/BILLS-119hr10089ih.htm"
    }
  ],
  "officialUrl": "https://www.congress.gov/bill/119th-congress/house-bill/10089",
  "updatedAt": "2026-08-24T18:06:37Z",
  "introducedAt": "2026-08-13"
}