{
  "id": "119-hr-10181",
  "billType": "hr",
  "billNumber": 10181,
  "congress": 119,
  "title": "To establish a national placement framework and grant program to prevent the disproportionate concentration of conditionally released sexually violent predators, and for other purposes.",
  "status": "inCommittee",
  "chamber": "House",
  "sponsor": {
    "memberId": "W000830",
    "name": "Rep. Whitesides, George [D-CA-27]",
    "party": "D",
    "state": "CA",
    "district": "27",
    "chamber": "House"
  },
  "cosponsorCount": 0,
  "latestAction": {
    "date": "2026-08-27",
    "text": "Referred to the House Committee on the Judiciary.",
    "chamber": "House"
  },
  "actions": [
    {
      "date": "2026-08-27",
      "text": "Referred to the House Committee on the Judiciary.",
      "chamber": "House",
      "actionCode": "H11100"
    },
    {
      "date": "2026-08-27",
      "text": "Introduced in House",
      "chamber": "House",
      "actionCode": "Intro-H"
    },
    {
      "date": "2026-08-27",
      "text": "Introduced in House",
      "chamber": "House",
      "actionCode": "1000"
    }
  ],
  "textVersions": [],
  "officialUrl": "https://www.congress.gov/bill/119th-congress/house-bill/10181",
  "updatedAt": "2026-08-28T11:13:50Z",
  "introducedAt": "2026-08-27"
}