{
  "id": "119-hr-10184",
  "billType": "hr",
  "billNumber": 10184,
  "congress": 119,
  "title": "Consumer Financial Protection Accountability and Reform Act of 2026",
  "status": "inCommittee",
  "chamber": "House",
  "policyArea": "Finance and Financial Sector",
  "sponsor": {
    "memberId": "B001282",
    "name": "Rep. Barr, Andy [R-KY-6]",
    "party": "R",
    "state": "KY",
    "district": "6",
    "chamber": "House"
  },
  "cosponsorCount": 29,
  "latestAction": {
    "date": "2026-08-31",
    "text": "Referred to the Committee on Financial Services, and in addition to the Committees on the Judiciary, Small Business, and Oversight and Government Reform, for a period to be subsequently determined by the Speaker, in each case for consideration of such provisions as fall within the jurisdiction of the committee concerned.",
    "chamber": "House"
  },
  "actions": [
    {
      "date": "2026-08-31",
      "text": "Referred to the Committee on Financial Services, and in addition to the Committees on the Judiciary, Small Business, and Oversight and Government Reform, for a period to be subsequently determined by the Speaker, in each case for consideration of such provisions as fall within the jurisdiction of the committee concerned.",
      "chamber": "House",
      "actionCode": "H11100"
    },
    {
      "date": "2026-08-31",
      "text": "Referred to the Committee on Financial Services, and in addition to the Committees on the Judiciary, Small Business, and Oversight and Government Reform, for a period to be subsequently determined by the Speaker, in each case for consideration of such provisions as fall within the jurisdiction of the committee concerned.",
      "chamber": "House",
      "actionCode": "H11100"
    },
    {
      "date": "2026-08-31",
      "text": "Referred to the Committee on Financial Services, and in addition to the Committees on the Judiciary, Small Business, and Oversight and Government Reform, for a period to be subsequently determined by the Speaker, in each case for consideration of such provisions as fall within the jurisdiction of the committee concerned.",
      "chamber": "House",
      "actionCode": "H11100"
    },
    {
      "date": "2026-08-31",
      "text": "Referred to the Committee on Financial Services, and in addition to the Committees on the Judiciary, Small Business, and Oversight and Government Reform, for a period to be subsequently determined by the Speaker, in each case for consideration of such provisions as fall within the jurisdiction of the committee concerned.",
      "chamber": "House",
      "actionCode": "H11100"
    },
    {
      "date": "2026-08-31",
      "text": "Introduced in House",
      "chamber": "House",
      "actionCode": "Intro-H"
    },
    {
      "date": "2026-08-31",
      "text": "Introduced in House",
      "chamber": "House",
      "actionCode": "1000"
    }
  ],
  "textVersions": [
    {
      "type": "Introduced in House",
      "date": "2026-08-31",
      "url": "https://www.congress.gov/119/bills/hr10184/BILLS-119hr10184ih.htm"
    }
  ],
  "officialUrl": "https://www.congress.gov/bill/119th-congress/house-bill/10184",
  "updatedAt": "2026-09-08T20:24:29Z",
  "introducedAt": "2026-08-31"
}