{
  "id": "119-hr-10169",
  "billType": "hr",
  "billNumber": 10169,
  "congress": 119,
  "title": "To prohibit the provision of Federal financial benefit for the construction, expansion, or substantial rehabilitation of data centers on prime farmland and other certain farmland.",
  "status": "inCommittee",
  "chamber": "House",
  "sponsor": {
    "memberId": "M001211",
    "name": "Rep. Miller, Mary E. [R-IL-15]",
    "party": "R",
    "state": "IL",
    "district": "15",
    "chamber": "House"
  },
  "cosponsorCount": 0,
  "latestAction": {
    "date": "2026-08-27",
    "text": "Referred to the House Committee on Energy and Commerce.",
    "chamber": "House"
  },
  "actions": [
    {
      "date": "2026-08-27",
      "text": "Referred to the House Committee on Energy and Commerce.",
      "chamber": "House",
      "actionCode": "H11100"
    },
    {
      "date": "2026-08-27",
      "text": "Introduced in House",
      "chamber": "House",
      "actionCode": "Intro-H"
    },
    {
      "date": "2026-08-27",
      "text": "Introduced in House",
      "chamber": "House",
      "actionCode": "1000"
    }
  ],
  "textVersions": [
    {
      "type": "Introduced in House",
      "date": "2026-08-27",
      "url": "https://www.congress.gov/119/bills/hr10169/BILLS-119hr10169ih.htm"
    }
  ],
  "officialUrl": "https://www.congress.gov/bill/119th-congress/house-bill/10169",
  "updatedAt": "2026-09-08T19:33:25Z",
  "introducedAt": "2026-08-27"
}