{
  "id": "119-s-5321",
  "billType": "s",
  "billNumber": 5321,
  "congress": 119,
  "title": "HCBS Access Act",
  "status": "inCommittee",
  "chamber": "Senate",
  "sponsor": {
    "memberId": "L000570",
    "name": "Sen. Luján, Ben Ray [D-NM]",
    "party": "D",
    "state": "NM",
    "chamber": "Senate"
  },
  "cosponsorCount": 16,
  "latestAction": {
    "date": "2026-08-06",
    "text": "Read twice and referred to the Committee on Finance.",
    "chamber": "Senate"
  },
  "actions": [
    {
      "date": "2026-08-06",
      "text": "Read twice and referred to the Committee on Finance.",
      "chamber": "Senate"
    },
    {
      "date": "2026-08-06",
      "text": "Introduced in Senate",
      "chamber": "Senate",
      "actionCode": "10000"
    }
  ],
  "textVersions": [
    {
      "type": "Introduced in Senate",
      "date": "2026-08-06",
      "url": "https://www.congress.gov/119/bills/s5321/BILLS-119s5321is.htm"
    }
  ],
  "officialUrl": "https://www.congress.gov/bill/119th-congress/senate-bill/5321",
  "updatedAt": "2026-08-13T02:53:43Z",
  "introducedAt": "2026-08-06"
}