{
  "id": "119-hres-1640",
  "billType": "hres",
  "billNumber": 1640,
  "congress": 119,
  "title": "Expressing support for the designation of October 2026 as \"National Financial Planning Month\".",
  "status": "inCommittee",
  "chamber": "House",
  "policyArea": "Finance and Financial Sector",
  "sponsor": {
    "memberId": "K000397",
    "name": "Rep. Kim, Young [R-CA-40]",
    "party": "R",
    "state": "CA",
    "district": "40",
    "chamber": "House"
  },
  "cosponsorCount": 1,
  "latestAction": {
    "date": "2026-10-26",
    "text": "Referred to the House Committee on Financial Services.",
    "chamber": "House"
  },
  "actions": [
    {
      "date": "2026-10-26",
      "text": "Referred to the House Committee on Financial Services.",
      "chamber": "House",
      "actionCode": "H11100"
    },
    {
      "date": "2026-10-26",
      "text": "Submitted in House",
      "chamber": "House",
      "actionCode": "1025"
    },
    {
      "date": "2026-10-26",
      "text": "Submitted in House",
      "chamber": "House",
      "actionCode": "1025"
    }
  ],
  "textVersions": [
    {
      "type": "Introduced in House",
      "date": "2026-10-26",
      "url": "https://www.congress.gov/119/bills/hres1640/BILLS-119hres1640ih.htm"
    }
  ],
  "officialUrl": "https://www.congress.gov/bill/119th-congress/house-resolution/1640",
  "updatedAt": "2026-10-29T11:58:30Z",
  "introducedAt": "2026-10-26"
}