{
  "id": "119-hres-1501",
  "billType": "hres",
  "billNumber": 1501,
  "congress": 119,
  "title": "Recognizing the 80th anniversary of the Fulbright Program.",
  "status": "inCommittee",
  "chamber": "House",
  "sponsor": {
    "memberId": "H001072",
    "name": "Rep. Hill, J. French [R-AR-2]",
    "party": "R",
    "state": "AR",
    "district": "2",
    "chamber": "House"
  },
  "cosponsorCount": 3,
  "latestAction": {
    "date": "2026-08-31",
    "text": "Referred to the House Committee on Foreign Affairs.",
    "chamber": "House"
  },
  "actions": [
    {
      "date": "2026-08-31",
      "text": "Referred to the House Committee on Foreign Affairs.",
      "chamber": "House",
      "actionCode": "H11100"
    },
    {
      "date": "2026-08-31",
      "text": "Submitted in House",
      "chamber": "House",
      "actionCode": "H11100"
    },
    {
      "date": "2026-08-31",
      "text": "Submitted in House",
      "chamber": "House",
      "actionCode": "1025"
    }
  ],
  "textVersions": [
    {
      "type": "Introduced in House",
      "date": "2026-08-31",
      "url": "https://www.congress.gov/119/bills/hres1501/BILLS-119hres1501ih.htm"
    }
  ],
  "officialUrl": "https://www.congress.gov/bill/119th-congress/house-resolution/1501",
  "updatedAt": "2026-09-01T08:48:27Z",
  "introducedAt": "2026-08-31"
}