{
  "id": "119-hr-11",
  "billType": "hr",
  "billNumber": 11,
  "congress": 119,
  "title": "Reserved for the Minority Leader.",
  "status": "introduced",
  "chamber": "House",
  "sponsor": {
    "memberId": "J000294",
    "name": "Rep. Jeffries, Hakeem S. [D-NY-8]",
    "party": "D",
    "state": "NY",
    "district": "8",
    "chamber": "House"
  },
  "cosponsorCount": 0,
  "latestAction": {
    "date": "2025-01-14",
    "text": "No latest action available.",
    "chamber": "House"
  },
  "actions": [],
  "textVersions": [],
  "officialUrl": "https://www.congress.gov/bill/119th-congress/house-bill/11",
  "updatedAt": "2025-01-14T09:05:50Z",
  "introducedAt": "2025-01-03"
}