{
  "id": "119-s-3404",
  "billType": "s",
  "billNumber": 3404,
  "congress": 119,
  "title": "Satellite Cybersecurity Act of 2025",
  "status": "introduced",
  "chamber": "Senate",
  "policyArea": "Science, Technology, Communications",
  "sponsor": {
    "memberId": "P000595",
    "name": "Sen. Peters, Gary C. [D-MI]",
    "party": "D",
    "state": "MI",
    "chamber": "Senate"
  },
  "cosponsorCount": 1,
  "latestAction": {
    "date": "2026-09-24",
    "text": "Held at the desk.",
    "chamber": "Senate"
  },
  "actions": [
    {
      "date": "2026-09-24",
      "text": "Held at the desk.",
      "chamber": "Senate",
      "actionCode": "H15000"
    },
    {
      "date": "2026-09-24",
      "text": "Received in the House.",
      "chamber": "Senate",
      "actionCode": "H14000"
    },
    {
      "date": "2026-09-24",
      "text": "Message on Senate action sent to the House.",
      "chamber": "Senate"
    },
    {
      "date": "2026-09-23",
      "text": "Passed Senate with an amendment by Unanimous Consent. (consideration: CR S4956-4958; text of amendment in the nature of a substitute: CR S4957-4958)",
      "chamber": "Senate"
    },
    {
      "date": "2026-09-23",
      "text": "Passed/agreed to in Senate: Passed Senate with an amendment by Unanimous Consent. (consideration: CR S4956-4958; text of amendment in the nature of a substitute: CR S4957-4958)",
      "chamber": "Senate",
      "actionCode": "17000"
    },
    {
      "date": "2026-09-14",
      "text": "Placed on Senate Legislative Calendar under General Orders. Calendar No. 560.",
      "chamber": "Senate"
    },
    {
      "date": "2026-09-14",
      "text": "Committee on Commerce, Science, and Transportation. Reported by Senator Cruz with an amendment in the nature of a substitute. With written report No. 119-141.",
      "chamber": "Senate"
    },
    {
      "date": "2026-09-14",
      "text": "Committee on Commerce, Science, and Transportation. Reported by Senator Cruz with an amendment in the nature of a substitute. With written report No. 119-141.",
      "chamber": "Senate",
      "actionCode": "14000"
    },
    {
      "date": "2026-04-14",
      "text": "Committee on Commerce, Science, and Transportation. Ordered to be reported with an amendment in the nature of a substitute favorably.",
      "chamber": "Senate"
    },
    {
      "date": "2025-12-09",
      "text": "Read twice and referred to the Committee on Commerce, Science, and Transportation.",
      "chamber": "Senate"
    },
    {
      "date": "2025-12-09",
      "text": "Introduced in Senate",
      "chamber": "Senate",
      "actionCode": "10000"
    }
  ],
  "textVersions": [
    {
      "type": "Engrossed in Senate",
      "date": "2026-09-23",
      "url": "https://www.congress.gov/119/bills/s3404/BILLS-119s3404es.htm"
    },
    {
      "type": "Reported to Senate",
      "date": "2026-09-14",
      "url": "https://www.congress.gov/119/bills/s3404/BILLS-119s3404rs.htm"
    },
    {
      "type": "Introduced in Senate",
      "date": "2025-12-09",
      "url": "https://www.congress.gov/119/bills/s3404/BILLS-119s3404is.htm"
    }
  ],
  "officialUrl": "https://www.congress.gov/bill/119th-congress/senate-bill/3404",
  "updatedAt": "2026-10-31T02:42:09Z",
  "introducedAt": "2025-12-09"
}