{
  "id": "119-hr-10068",
  "billType": "hr",
  "billNumber": 10068,
  "congress": 119,
  "title": "PROTECT Act",
  "status": "inCommittee",
  "chamber": "House",
  "policyArea": "Health",
  "sponsor": {
    "memberId": "W000797",
    "name": "Rep. Wasserman Schultz, Debbie [D-FL-25]",
    "party": "D",
    "state": "FL",
    "district": "25",
    "chamber": "House"
  },
  "cosponsorCount": 2,
  "latestAction": {
    "date": "2026-08-06",
    "text": "Referred to the House Committee on Energy and Commerce.",
    "chamber": "House"
  },
  "actions": [
    {
      "date": "2026-08-06",
      "text": "Referred to the House Committee on Energy and Commerce.",
      "chamber": "House",
      "actionCode": "H11100"
    },
    {
      "date": "2026-08-06",
      "text": "Introduced in House",
      "chamber": "House",
      "actionCode": "Intro-H"
    },
    {
      "date": "2026-08-06",
      "text": "Introduced in House",
      "chamber": "House",
      "actionCode": "1000"
    }
  ],
  "textVersions": [
    {
      "type": "Introduced in House",
      "date": "2026-08-06",
      "url": "https://www.congress.gov/119/bills/hr10068/BILLS-119hr10068ih.htm"
    }
  ],
  "officialUrl": "https://www.congress.gov/bill/119th-congress/house-bill/10068",
  "updatedAt": "2026-08-19T17:54:54Z",
  "introducedAt": "2026-08-06"
}