{
  "id": "119-s-5650",
  "billType": "s",
  "billNumber": 5650,
  "congress": 119,
  "title": "SPR Readiness and Long-Term Modernization Act",
  "status": "inCommittee",
  "chamber": "Senate",
  "sponsor": {
    "memberId": "H001046",
    "name": "Sen. Heinrich, Martin [D-NM]",
    "party": "D",
    "state": "NM",
    "chamber": "Senate"
  },
  "cosponsorCount": 0,
  "latestAction": {
    "date": "2026-09-30",
    "text": "Read twice and referred to the Committee on Energy and Natural Resources.",
    "chamber": "Senate"
  },
  "actions": [
    {
      "date": "2026-09-30",
      "text": "Read twice and referred to the Committee on Energy and Natural Resources.",
      "chamber": "Senate"
    },
    {
      "date": "2026-09-30",
      "text": "Introduced in Senate",
      "chamber": "Senate",
      "actionCode": "10000"
    }
  ],
  "textVersions": [
    {
      "type": "Introduced in Senate",
      "date": "2026-09-30",
      "url": "https://www.congress.gov/119/bills/s5650/BILLS-119s5650is.htm"
    }
  ],
  "officialUrl": "https://www.congress.gov/bill/119th-congress/senate-bill/5650",
  "updatedAt": "2026-10-09T03:38:26Z",
  "introducedAt": "2026-09-30"
}