{
  "id": "119-hr-10041",
  "billType": "hr",
  "billNumber": 10041,
  "congress": 119,
  "title": "Smart Data Center Policy Act",
  "status": "inCommittee",
  "chamber": "House",
  "sponsor": {
    "memberId": "V000138",
    "name": "Rep. Vindman, Eugene Simon [D-VA-7]",
    "party": "D",
    "state": "VA",
    "district": "7",
    "chamber": "House"
  },
  "cosponsorCount": 0,
  "latestAction": {
    "date": "2026-08-03",
    "text": "Referred to the Committee on Transportation and Infrastructure, and in addition to the Committees on Armed Services, and Energy and Commerce, for a period to be subsequently determined by the Speaker, in each case for consideration of such provisions as fall within the jurisdiction of the committee concerned.",
    "chamber": "House"
  },
  "actions": [
    {
      "date": "2026-08-03",
      "text": "Referred to the Committee on Transportation and Infrastructure, and in addition to the Committees on Armed Services, and Energy and Commerce, for a period to be subsequently determined by the Speaker, in each case for consideration of such provisions as fall within the jurisdiction of the committee concerned.",
      "chamber": "House",
      "actionCode": "H11100"
    },
    {
      "date": "2026-08-03",
      "text": "Referred to the Committee on Transportation and Infrastructure, and in addition to the Committees on Armed Services, and Energy and Commerce, for a period to be subsequently determined by the Speaker, in each case for consideration of such provisions as fall within the jurisdiction of the committee concerned.",
      "chamber": "House",
      "actionCode": "H11100"
    },
    {
      "date": "2026-08-03",
      "text": "Referred to the Committee on Transportation and Infrastructure, and in addition to the Committees on Armed Services, and Energy and Commerce, for a period to be subsequently determined by the Speaker, in each case for consideration of such provisions as fall within the jurisdiction of the committee concerned.",
      "chamber": "House",
      "actionCode": "H11100"
    },
    {
      "date": "2026-08-03",
      "text": "Introduced in House",
      "chamber": "House",
      "actionCode": "Intro-H"
    },
    {
      "date": "2026-08-03",
      "text": "Introduced in House",
      "chamber": "House",
      "actionCode": "1000"
    }
  ],
  "textVersions": [
    {
      "type": "Introduced in House",
      "date": "2026-08-03",
      "url": "https://www.congress.gov/119/bills/hr10041/BILLS-119hr10041ih.htm"
    }
  ],
  "officialUrl": "https://www.congress.gov/bill/119th-congress/house-bill/10041",
  "updatedAt": "2026-08-05T05:53:23Z",
  "introducedAt": "2026-08-03"
}