{
  "id": "119-hr-10569",
  "billType": "hr",
  "billNumber": 10569,
  "congress": 119,
  "title": "Protecting Biotechnology and Biomanufacturing as Critical Infrastructure Act",
  "status": "inCommittee",
  "chamber": "House",
  "sponsor": {
    "memberId": "K000389",
    "name": "Rep. Khanna, Ro [D-CA-17]",
    "party": "D",
    "state": "CA",
    "district": "17",
    "chamber": "House"
  },
  "cosponsorCount": 2,
  "latestAction": {
    "date": "2026-09-24",
    "text": "Referred to the House Committee on Homeland Security.",
    "chamber": "House"
  },
  "actions": [
    {
      "date": "2026-09-24",
      "text": "Referred to the House Committee on Homeland Security.",
      "chamber": "House",
      "actionCode": "H11100"
    },
    {
      "date": "2026-09-24",
      "text": "Introduced in House",
      "chamber": "House",
      "actionCode": "Intro-H"
    },
    {
      "date": "2026-09-24",
      "text": "Introduced in House",
      "chamber": "House",
      "actionCode": "1000"
    }
  ],
  "textVersions": [
    {
      "type": "Introduced in House",
      "date": "2026-09-24",
      "url": "https://www.congress.gov/119/bills/hr10569/BILLS-119hr10569ih.htm"
    }
  ],
  "officialUrl": "https://www.congress.gov/bill/119th-congress/house-bill/10569",
  "updatedAt": "2026-09-28T12:53:23Z",
  "introducedAt": "2026-09-24"
}