{
  "id": "119-sres-863",
  "billType": "sres",
  "billNumber": 863,
  "congress": 119,
  "title": "A resolution expressing support for designation of the week of September 13 through 19, 2026, as \"National Adult Education and Family Literacy Week\".",
  "status": "introduced",
  "chamber": "Senate",
  "sponsor": {
    "memberId": "R000122",
    "name": "Sen. Reed, Jack [D-RI]",
    "party": "D",
    "state": "RI",
    "chamber": "Senate"
  },
  "cosponsorCount": 6,
  "latestAction": {
    "date": "2026-09-23",
    "text": "Resolution agreed to in Senate without amendment and with a preamble by Unanimous Consent.",
    "chamber": "Senate"
  },
  "actions": [
    {
      "date": "2026-09-23",
      "text": "Resolution agreed to in Senate without amendment and with a preamble by Unanimous Consent.",
      "chamber": "Senate"
    },
    {
      "date": "2026-09-23",
      "text": "Passed/agreed to in Senate: Resolution agreed to in Senate without amendment and with a preamble by Unanimous Consent.",
      "chamber": "Senate",
      "actionCode": "17000"
    },
    {
      "date": "2026-09-23",
      "text": "Senate Committee on Health, Education, Labor, and Pensions discharged by Unanimous Consent.",
      "chamber": "Senate"
    },
    {
      "date": "2026-09-23",
      "text": "Senate Committee on Health, Education, Labor, and Pensions discharged by Unanimous Consent.",
      "chamber": "Senate",
      "actionCode": "14500"
    },
    {
      "date": "2026-09-17",
      "text": "Referred to the Committee on Health, Education, Labor, and Pensions. (text: CR S4800-4801)",
      "chamber": "Senate"
    },
    {
      "date": "2026-09-17",
      "text": "Submitted in Senate",
      "chamber": "Senate",
      "actionCode": "10025"
    }
  ],
  "textVersions": [
    {
      "type": "Introduced in Senate",
      "date": "2026-09-17",
      "url": "https://www.congress.gov/119/bills/sres863/BILLS-119sres863is.htm"
    }
  ],
  "officialUrl": "https://www.congress.gov/bill/119th-congress/senate-resolution/863",
  "updatedAt": "2026-09-24T10:56:47Z",
  "introducedAt": "2026-09-17"
}