{
  "id": "119-s-5546",
  "billType": "s",
  "billNumber": 5546,
  "congress": 119,
  "title": "Jeanette Acosta Invest in Women’s Health Act of 2026",
  "status": "inCommittee",
  "chamber": "Senate",
  "sponsor": {
    "memberId": "M001111",
    "name": "Sen. Murray, Patty [D-WA]",
    "party": "D",
    "state": "WA",
    "chamber": "Senate"
  },
  "cosponsorCount": 15,
  "latestAction": {
    "date": "2026-09-24",
    "text": "Read twice and referred to the Committee on Health, Education, Labor, and Pensions.",
    "chamber": "Senate"
  },
  "actions": [
    {
      "date": "2026-09-24",
      "text": "Read twice and referred to the Committee on Health, Education, Labor, and Pensions.",
      "chamber": "Senate"
    },
    {
      "date": "2026-09-24",
      "text": "Introduced in Senate",
      "chamber": "Senate",
      "actionCode": "10000"
    }
  ],
  "textVersions": [
    {
      "type": "Introduced in Senate",
      "date": "2026-09-24",
      "url": "https://www.congress.gov/119/bills/s5546/BILLS-119s5546is.htm"
    }
  ],
  "officialUrl": "https://www.congress.gov/bill/119th-congress/senate-bill/5546",
  "updatedAt": "2026-10-03T04:23:24Z",
  "introducedAt": "2026-09-24"
}