{
  "id": "119-hr-10049",
  "billType": "hr",
  "billNumber": 10049,
  "congress": 119,
  "title": "To amend the Internal Revenue Code of 1986 to improve the low-income housing credit.",
  "status": "inCommittee",
  "chamber": "House",
  "sponsor": {
    "memberId": "E000296",
    "name": "Rep. Evans, Dwight [D-PA-3]",
    "party": "D",
    "state": "PA",
    "district": "3",
    "chamber": "House"
  },
  "cosponsorCount": 1,
  "latestAction": {
    "date": "2026-08-06",
    "text": "Referred to the House Committee on Ways and Means.",
    "chamber": "House"
  },
  "actions": [
    {
      "date": "2026-08-06",
      "text": "Referred to the House Committee on Ways and Means.",
      "chamber": "House",
      "actionCode": "H11100"
    },
    {
      "date": "2026-08-06",
      "text": "Introduced in House",
      "chamber": "House",
      "actionCode": "Intro-H"
    },
    {
      "date": "2026-08-06",
      "text": "Introduced in House",
      "chamber": "House",
      "actionCode": "1000"
    }
  ],
  "textVersions": [
    {
      "type": "Introduced in House",
      "date": "2026-08-06",
      "url": "https://www.congress.gov/119/bills/hr10049/BILLS-119hr10049ih.htm"
    }
  ],
  "officialUrl": "https://www.congress.gov/bill/119th-congress/house-bill/10049",
  "updatedAt": "2026-08-07T08:05:42Z",
  "introducedAt": "2026-08-06"
}