{
  "id": "119-hr-10525",
  "billType": "hr",
  "billNumber": 10525,
  "congress": 119,
  "title": "Tropospheric Ozone Research Act of 2026",
  "status": "inCommittee",
  "chamber": "House",
  "sponsor": {
    "memberId": "R000305",
    "name": "Rep. Ross, Deborah K. [D-NC-2]",
    "party": "D",
    "state": "NC",
    "district": "2",
    "chamber": "House"
  },
  "cosponsorCount": 1,
  "latestAction": {
    "date": "2026-09-21",
    "text": "Referred to the House Committee on Science, Space, and Technology.",
    "chamber": "House"
  },
  "actions": [
    {
      "date": "2026-09-21",
      "text": "Referred to the House Committee on Science, Space, and Technology.",
      "chamber": "House",
      "actionCode": "H11100"
    },
    {
      "date": "2026-09-21",
      "text": "Introduced in House",
      "chamber": "House",
      "actionCode": "Intro-H"
    },
    {
      "date": "2026-09-21",
      "text": "Introduced in House",
      "chamber": "House",
      "actionCode": "1000"
    }
  ],
  "textVersions": [
    {
      "type": "Introduced in House",
      "date": "2026-09-21",
      "url": "https://www.congress.gov/119/bills/hr10525/BILLS-119hr10525ih.htm"
    }
  ],
  "officialUrl": "https://www.congress.gov/bill/119th-congress/house-bill/10525",
  "updatedAt": "2026-09-22T11:43:22Z",
  "introducedAt": "2026-09-21"
}