{
  "id": "119-hr-5254",
  "billType": "hr",
  "billNumber": 5254,
  "congress": 119,
  "title": "Gateway Partnership Act",
  "status": "introduced",
  "chamber": "House",
  "policyArea": "Public Lands and Natural Resources",
  "sponsor": {
    "memberId": "B001324",
    "name": "Rep. Bell, Wesley [D-MO-1]",
    "party": "D",
    "state": "MO",
    "district": "1",
    "chamber": "House"
  },
  "cosponsorCount": 2,
  "latestAction": {
    "date": "2026-09-17",
    "text": "Placed on Senate Legislative Calendar under General Orders. Calendar No. 662.",
    "chamber": "House"
  },
  "actions": [
    {
      "date": "2026-09-17",
      "text": "Placed on Senate Legislative Calendar under General Orders. Calendar No. 662.",
      "chamber": "House"
    },
    {
      "date": "2026-09-17",
      "text": "Committee on Energy and Natural Resources. Reported by Senator Lee with an amendment in the nature of a substitute. Without written report.",
      "chamber": "House"
    },
    {
      "date": "2026-09-17",
      "text": "Committee on Energy and Natural Resources. Reported by Senator Lee with an amendment in the nature of a substitute. Without written report.",
      "chamber": "House",
      "actionCode": "14000"
    },
    {
      "date": "2026-07-29",
      "text": "Committee on Energy and Natural Resources. Ordered to be reported with an amendment in the nature of a substitute favorably.",
      "chamber": "House"
    },
    {
      "date": "2026-07-21",
      "text": "Committee on Energy and Natural Resources Subcommittee on National Parks. Hearings held.",
      "chamber": "House"
    },
    {
      "date": "2026-03-17",
      "text": "Received in the Senate and Read twice and referred to the Committee on Energy and Natural Resources.",
      "chamber": "House"
    },
    {
      "date": "2026-03-16",
      "text": "Motion to reconsider laid on the table Agreed to without objection.",
      "chamber": "House",
      "actionCode": "H38310"
    },
    {
      "date": "2026-03-16",
      "text": "On motion to suspend the rules and pass the bill, as amended Agreed to by voice vote. (text: CR H2519-2520)",
      "chamber": "House",
      "actionCode": "H37300"
    },
    {
      "date": "2026-03-16",
      "text": "Passed/agreed to in House: On motion to suspend the rules and pass the bill, as amended Agreed to by voice vote. (text: CR H2519-2520)",
      "chamber": "House",
      "actionCode": "8000"
    },
    {
      "date": "2026-03-16",
      "text": "DEBATE - The House proceeded with forty minutes of debate on H.R. 5254.",
      "chamber": "House",
      "actionCode": "H8D000"
    },
    {
      "date": "2026-03-16",
      "text": "Considered under suspension of the rules. (consideration: CR H2519-2521)",
      "chamber": "House",
      "actionCode": "H30000"
    },
    {
      "date": "2026-03-16",
      "text": "Mr. Wittman moved to suspend the rules and pass the bill, as amended.",
      "chamber": "House",
      "actionCode": "H30300"
    },
    {
      "date": "2026-03-02",
      "text": "Placed on the Union Calendar, Calendar No. 461.",
      "chamber": "House",
      "actionCode": "H12410"
    },
    {
      "date": "2026-03-02",
      "text": "Reported (Amended) by the Committee on Natural Resources. H. Rept. 119-536.",
      "chamber": "House",
      "actionCode": "H12200"
    },
    {
      "date": "2026-03-02",
      "text": "Reported (Amended) by the Committee on Natural Resources. H. Rept. 119-536.",
      "chamber": "House",
      "actionCode": "5000"
    },
    {
      "date": "2026-01-22",
      "text": "Ordered to be Reported in the Nature of a Substitute (Amended) by Unanimous Consent.",
      "chamber": "House",
      "actionCode": "H19000"
    },
    {
      "date": "2026-01-22",
      "text": "Committee Consideration and Mark-up Session Held",
      "chamber": "House",
      "actionCode": "H15001"
    },
    {
      "date": "2026-01-22",
      "text": "Subcommittee on Federal Lands Discharged",
      "chamber": "House",
      "actionCode": "H25000"
    },
    {
      "date": "2025-12-02",
      "text": "Subcommittee Hearings Held",
      "chamber": "House",
      "actionCode": "H21000"
    },
    {
      "date": "2025-11-25",
      "text": "Referred to the Subcommittee on Federal Lands.",
      "chamber": "House",
      "actionCode": "H11000"
    },
    {
      "date": "2025-09-10",
      "text": "Referred to the House Committee on Natural Resources.",
      "chamber": "House",
      "actionCode": "H11100"
    },
    {
      "date": "2025-09-10",
      "text": "Introduced in House",
      "chamber": "House",
      "actionCode": "Intro-H"
    },
    {
      "date": "2025-09-10",
      "text": "Introduced in House",
      "chamber": "House",
      "actionCode": "1000"
    }
  ],
  "textVersions": [
    {
      "type": "Referred in Senate",
      "date": "2026-03-17",
      "url": "https://www.congress.gov/119/bills/hr5254/BILLS-119hr5254rfs.htm"
    },
    {
      "type": "Engrossed in House",
      "date": "2026-03-16",
      "url": "https://www.congress.gov/119/bills/hr5254/BILLS-119hr5254eh.htm"
    },
    {
      "type": "Reported in House",
      "date": "2026-03-02",
      "url": "https://www.congress.gov/119/bills/hr5254/BILLS-119hr5254rh.htm"
    },
    {
      "type": "Introduced in House",
      "date": "2025-09-10",
      "url": "https://www.congress.gov/119/bills/hr5254/BILLS-119hr5254ih.htm"
    }
  ],
  "summaryHtml": "<p><strong>Gateway Partnership Act</strong></p><p>This bill authorizes the National Park Service (NPS) to enter into a one-time agreement with the Gateway Arch Park Foundation to host private events at the Gateway Arch National Park and its buildings for a period of up to five years. The NPS manages the park, located in St. Louis, Missouri, and&nbsp;its buildings, such as the Arch Visitor Center and the Old Courthouse.</p><p>The bill outlines the terms and conditions that must be included in the agreement. The bill also requires private events hosted at the park or its buildings to be consistent with the park's purposes and compatible with NPS programs. Such events may not (1) degrade the integrity, appearance, or purposes of the park; or (2) take place during times or in locations that prevent or disrupt public use or access to the park or its buildings.</p><p>The NPS must charge a fee to cover the cost of wear and tear resulting from the private events. The NPS may recover all costs incurred as a result of the private events, including maintenance, utilities, administrative expenses, security, and personnel costs.</p><p>The bill terminates the NPS's authority to enter&nbsp;and&nbsp;carry out an agreement with the foundation seven years after the enactment of this bill.</p>",
  "summaryFormat": "html",
  "summary": "Gateway Partnership Act This bill authorizes the National Park Service (NPS) to enter into a one-time agreement with the Gateway Arch Park Foundation to host private events at the Gateway Arch National Park and its buildings for a period of up to five years. The NPS manages the park, located in St. Louis, Missouri, and its buildings, such as the Arch Visitor Center and the Old Courthouse. The bill outlines the terms and conditions that must be included in the agreement. The bill also requires private events hosted at the park or its buildings to be consistent with the park's purposes and compatible with NPS programs. Such events may not (1) degrade the integrity, appearance, or purposes of the park; or (2) take place during times or in locations that prevent or disrupt public use or access to the park or its buildings. The NPS must charge a fee to cover the cost of wear and tear resulting from the private events. The NPS may recover all costs incurred as a result of the private events, including maintenance, utilities, administrative expenses, security, and personnel costs. The bill terminates the NPS's authority to enter and carry out an agreement with the foundation seven years after the enactment of this bill.",
  "summarySource": "official",
  "officialUrl": "https://www.congress.gov/bill/119th-congress/house-bill/5254",
  "updatedAt": "2026-09-19T10:56:17Z",
  "introducedAt": "2025-09-10"
}