{
  "id": "119-hres-1530",
  "billType": "hres",
  "billNumber": 1530,
  "congress": 119,
  "title": "Providing for consideration of the bill (H.R. 9576) to establish the National Fraud Enforcement Division of the Department of Justice; providing for consideration of the bill (H.R. 10326) to enhance information-sharing capabilities between Federal law enforcement and State agencies to detect, investigate, and prosecute fraud in certain Federal programs, and to protect individual privacy; providing for consideration of the joint resolution (H.J. Res. 210) providing for congressional disapproval under chapter 8 of title 5, United States Code, of the rule submitted by the Environmental Protection Agency relating to ''California State Nonroad Engine Pollution Control Standards; Ocean-Going Vessels At-Berth; Notice of Decision''; providing for consideration of the joint resolution (H.J. Res. 213) providing for congressional disapproval under chapter 8 of title 5, United States Code, of the rule issued by the Environmental Protection Agency relating to the ''California State Nonroad Engine Pollution Control Standards; Commercial Harbor Craft Regulations; Notice of Decision''; and providing for consideration of the Senate amendments to the bill (H.R. 5334) to amend the Internal Revenue Code of 1986 to allow early childhood educators to take the educator expense deduction, and for other purposes.",
  "status": "introduced",
  "chamber": "House",
  "sponsor": {
    "memberId": "F000470",
    "name": "Rep. Fischbach, Michelle [R-MN-7]",
    "party": "R",
    "state": "MN",
    "district": "7",
    "chamber": "House"
  },
  "cosponsorCount": 0,
  "latestAction": {
    "date": "2026-09-14",
    "text": "Placed on the House Calendar, Calendar No. 90.",
    "chamber": "House"
  },
  "actions": [
    {
      "date": "2026-09-14",
      "text": "Placed on the House Calendar, Calendar No. 90.",
      "chamber": "House",
      "actionCode": "H12420"
    },
    {
      "date": "2026-09-14",
      "text": "The resolution provides for consideration of H.R. 9576, H.R. 10326, H.J.Res. 210, and H.J.Res. 213 under a closed rule with one hour of debate on each measure. The resolution provides for a motion to concur in the Senate amendments to H.R. 5334.",
      "chamber": "House",
      "actionCode": "H12700"
    },
    {
      "date": "2026-09-14",
      "text": "The House Committee on Rules reported an original measure, H. Rept. 119-825, by Mrs. Fischbach.",
      "chamber": "House",
      "actionCode": "H12100"
    },
    {
      "date": "2026-09-14",
      "text": "The House Committee on Rules reported an original measure, H. Rept. 119-825, by Mrs. Fischbach.",
      "chamber": "House",
      "actionCode": "1010"
    }
  ],
  "textVersions": [
    {
      "type": "Reported in House",
      "date": "2026-09-14",
      "url": "https://www.congress.gov/119/bills/hres1530/BILLS-119hres1530rh.htm"
    }
  ],
  "officialUrl": "https://www.congress.gov/bill/119th-congress/house-resolution/1530",
  "updatedAt": "2026-09-15T12:11:20Z",
  "introducedAt": "2026-09-14"
}