{
  "id": "119-hr-10028",
  "billType": "hr",
  "billNumber": 10028,
  "congress": 119,
  "title": "To require the Federal National Mortgage Association and the Federal Home Loan Mortgage Corporation to begin purchasing and securitizing portable mortgages, and for other purposes.",
  "status": "inCommittee",
  "chamber": "House",
  "sponsor": {
    "memberId": "K000398",
    "name": "Rep. Kean, Thomas H. [R-NJ-7]",
    "party": "R",
    "state": "NJ",
    "district": "7",
    "chamber": "House"
  },
  "cosponsorCount": 0,
  "latestAction": {
    "date": "2026-08-03",
    "text": "Referred to the House Committee on Financial Services.",
    "chamber": "House"
  },
  "actions": [
    {
      "date": "2026-08-03",
      "text": "Referred to the House Committee on Financial Services.",
      "chamber": "House",
      "actionCode": "H11100"
    },
    {
      "date": "2026-08-03",
      "text": "Introduced in House",
      "chamber": "House",
      "actionCode": "Intro-H"
    },
    {
      "date": "2026-08-03",
      "text": "Introduced in House",
      "chamber": "House",
      "actionCode": "1000"
    }
  ],
  "textVersions": [],
  "officialUrl": "https://www.congress.gov/bill/119th-congress/house-bill/10028",
  "updatedAt": "2026-08-04T08:07:35Z",
  "introducedAt": "2026-08-03"
}