{
  "id": "119-sconres-39",
  "billType": "sconres",
  "billNumber": 39,
  "congress": 119,
  "title": "A concurrent resolution setting forth the congressional budget for the United States Government for fiscal year 2027 and setting forth the appropriate budgetary levels for fiscal years 2028 through 2036.",
  "status": "introduced",
  "chamber": "Senate",
  "sponsor": {
    "memberId": "P000603",
    "name": "Sen. Paul, Rand [R-KY]",
    "party": "R",
    "state": "KY",
    "chamber": "Senate"
  },
  "cosponsorCount": 0,
  "latestAction": {
    "date": "2026-08-07",
    "text": "Placed on Senate Legislative Calendar under General Orders. Calendar No. 551. (text: CR S4577-4583)",
    "chamber": "Senate"
  },
  "actions": [
    {
      "date": "2026-08-07",
      "text": "Placed on Senate Legislative Calendar under General Orders. Calendar No. 551. (text: CR S4577-4583)",
      "chamber": "Senate"
    },
    {
      "date": "2026-08-07",
      "text": "Senate Committee on the Budget discharged pursuant to Section 300 of the Congressional Budget Act.",
      "chamber": "Senate"
    },
    {
      "date": "2026-08-07",
      "text": "Senate Committee on the Budget discharged pursuant to Section 300 of the Congressional Budget Act.",
      "chamber": "Senate",
      "actionCode": "14500"
    },
    {
      "date": "2026-08-07",
      "text": "Referred to the Committee on the Budget.",
      "chamber": "Senate"
    },
    {
      "date": "2026-08-07",
      "text": "Submitted in Senate",
      "chamber": "Senate",
      "actionCode": "10025"
    }
  ],
  "textVersions": [
    {
      "type": "Placed on Calendar Senate",
      "date": "2026-08-07",
      "url": "https://www.congress.gov/119/bills/sconres39/BILLS-119sconres39pcs.htm"
    }
  ],
  "officialUrl": "https://www.congress.gov/bill/119th-congress/senate-concurrent-resolution/39",
  "updatedAt": "2026-08-12T08:11:59Z",
  "introducedAt": "2026-08-07"
}