{
  "id": "119-hr-7730",
  "billType": "hr",
  "billNumber": 7730,
  "congress": 119,
  "title": "Bankruptcy Threshold Adjustment Act",
  "status": "introduced",
  "chamber": "House",
  "policyArea": "Finance and Financial Sector",
  "sponsor": {
    "memberId": "C001118",
    "name": "Rep. Cline, Ben [R-VA-6]",
    "party": "R",
    "state": "VA",
    "district": "6",
    "chamber": "House"
  },
  "cosponsorCount": 6,
  "latestAction": {
    "date": "2026-10-14",
    "text": "Message on Senate action sent to the House.",
    "chamber": "House"
  },
  "actions": [
    {
      "date": "2026-10-14",
      "text": "Message on Senate action sent to the House.",
      "chamber": "House"
    },
    {
      "date": "2026-09-28",
      "text": "Passed Senate without amendment by Unanimous Consent. (consideration: CR S5123)",
      "chamber": "House"
    },
    {
      "date": "2026-09-28",
      "text": "Passed/agreed to in Senate: Passed Senate without amendment by Unanimous Consent. (consideration: CR S5123)",
      "chamber": "House",
      "actionCode": "17000"
    },
    {
      "date": "2026-09-17",
      "text": "Received in the Senate, read twice.",
      "chamber": "House"
    },
    {
      "date": "2026-09-16",
      "text": "Motion to reconsider laid on the table Agreed to without objection.",
      "chamber": "House",
      "actionCode": "H38310"
    },
    {
      "date": "2026-09-16",
      "text": "On motion to suspend the rules and pass the bill, as amended Agreed to by voice vote. (text: CR H5939-5940)",
      "chamber": "House",
      "actionCode": "H37300"
    },
    {
      "date": "2026-09-16",
      "text": "Passed/agreed to in House: On motion to suspend the rules and pass the bill, as amended Agreed to by voice vote.",
      "chamber": "House",
      "actionCode": "8000"
    },
    {
      "date": "2026-09-16",
      "text": "DEBATE - The House proceeded with forty minutes of debate on H.R. 7730.",
      "chamber": "House",
      "actionCode": "H8D000"
    },
    {
      "date": "2026-09-16",
      "text": "Considered under suspension of the rules. (consideration: CR H5939-5941)",
      "chamber": "House",
      "actionCode": "H30000"
    },
    {
      "date": "2026-09-16",
      "text": "Mr. Cline moved to suspend the rules and pass the bill, as amended.",
      "chamber": "House",
      "actionCode": "H30300"
    },
    {
      "date": "2026-08-27",
      "text": "Placed on the Union Calendar, Calendar No. 684.",
      "chamber": "House",
      "actionCode": "H12410"
    },
    {
      "date": "2026-08-27",
      "text": "Reported (Amended) by the Committee on Judiciary. H. Rept. 119-783.",
      "chamber": "House",
      "actionCode": "H12200"
    },
    {
      "date": "2026-08-27",
      "text": "Reported (Amended) by the Committee on Judiciary. H. Rept. 119-783.",
      "chamber": "House",
      "actionCode": "5000"
    },
    {
      "date": "2026-03-26",
      "text": "Ordered to be Reported (Amended) by Voice Vote.",
      "chamber": "House",
      "actionCode": "H19000"
    },
    {
      "date": "2026-03-26",
      "text": "Committee Consideration and Mark-up Session Held",
      "chamber": "House",
      "actionCode": "H15001"
    },
    {
      "date": "2026-02-26",
      "text": "Referred to the House Committee on the Judiciary.",
      "chamber": "House",
      "actionCode": "H11100"
    },
    {
      "date": "2026-02-26",
      "text": "Introduced in House",
      "chamber": "House",
      "actionCode": "Intro-H"
    },
    {
      "date": "2026-02-26",
      "text": "Introduced in House",
      "chamber": "House",
      "actionCode": "1000"
    }
  ],
  "textVersions": [
    {
      "type": "Enrolled Bill",
      "date": "1970-01-01",
      "url": "https://www.congress.gov/119/bills/hr7730/BILLS-119hr7730enr.htm"
    },
    {
      "type": "Received in Senate",
      "date": "2026-09-17",
      "url": "https://www.congress.gov/119/bills/hr7730/BILLS-119hr7730rds.htm"
    },
    {
      "type": "Engrossed in House",
      "date": "2026-09-16",
      "url": "https://www.congress.gov/119/bills/hr7730/BILLS-119hr7730eh.htm"
    },
    {
      "type": "Reported in House",
      "date": "2026-08-27",
      "url": "https://www.congress.gov/119/bills/hr7730/BILLS-119hr7730rh.htm"
    },
    {
      "type": "Introduced in House",
      "date": "2026-02-26",
      "url": "https://www.congress.gov/119/bills/hr7730/BILLS-119hr7730ih.htm"
    }
  ],
  "summaryHtml": "<p><strong>Bankruptcy Threshold Adjustment Act of 2026</strong></p><p>This bill restores changes that expired in 2024 applicable to debt limits for Subchapter V (small business reorganization) and Chapter 13 (the wage earner's plan) bankruptcies.</p><p>Specifically, the bill increases the debt limit under Subchapter&nbsp;V from approximately $3.4 million to $7.5 million and increases the cumulative debt limit under Chapter 13 from approximately $2.1 million to $2.75 million.</p><p>The bill also applies both secured and unsecured debt towards the Chapter 13 limit. (Currently, separate limits apply to secured and unsecured debt under Chapter 13 bankruptcy.)</p>",
  "summaryFormat": "html",
  "summary": "Bankruptcy Threshold Adjustment Act of 2026 This bill restores changes that expired in 2024 applicable to debt limits for Subchapter V (small business reorganization) and Chapter 13 (the wage earner's plan) bankruptcies. Specifically, the bill increases the debt limit under Subchapter V from approximately $3.4 million to $7.5 million and increases the cumulative debt limit under Chapter 13 from approximately $2.1 million to $2.75 million. The bill also applies both secured and unsecured debt towards the Chapter 13 limit. (Currently, separate limits apply to secured and unsecured debt under Chapter 13 bankruptcy.)",
  "summarySource": "official",
  "officialUrl": "https://www.congress.gov/bill/119th-congress/house-bill/7730",
  "updatedAt": "2026-10-15T10:56:20Z",
  "introducedAt": "2026-02-26"
}