{
  "id": "119-hr-10915",
  "billType": "hr",
  "billNumber": 10915,
  "congress": 119,
  "title": "To require the Director of the National Institute of Standards and Technology to develop new standards, methodologies, and recommendations with respect to the cybersecurity of cloud-based infrastructure, and for other purposes.",
  "status": "inCommittee",
  "chamber": "House",
  "sponsor": {
    "memberId": "M001218",
    "name": "Rep. McCormick, Richard [R-GA-7]",
    "party": "R",
    "state": "GA",
    "district": "7",
    "chamber": "House"
  },
  "cosponsorCount": 0,
  "latestAction": {
    "date": "2026-10-26",
    "text": "Referred to the Committee on Science, Space, and Technology, and in addition to the Committee on Oversight and Government Reform, for a period to be subsequently determined by the Speaker, in each case for consideration of such provisions as fall within the jurisdiction of the committee concerned.",
    "chamber": "House"
  },
  "actions": [
    {
      "date": "2026-10-26",
      "text": "Referred to the Committee on Science, Space, and Technology, and in addition to the Committee on Oversight and Government Reform, for a period to be subsequently determined by the Speaker, in each case for consideration of such provisions as fall within the jurisdiction of the committee concerned.",
      "chamber": "House",
      "actionCode": "H11100"
    },
    {
      "date": "2026-10-26",
      "text": "Referred to the Committee on Science, Space, and Technology, and in addition to the Committee on Oversight and Government Reform, for a period to be subsequently determined by the Speaker, in each case for consideration of such provisions as fall within the jurisdiction of the committee concerned.",
      "chamber": "House",
      "actionCode": "H11100"
    },
    {
      "date": "2026-10-26",
      "text": "Introduced in House",
      "chamber": "House",
      "actionCode": "Intro-H"
    },
    {
      "date": "2026-10-26",
      "text": "Introduced in House",
      "chamber": "House",
      "actionCode": "1000"
    }
  ],
  "textVersions": [],
  "officialUrl": "https://www.congress.gov/bill/119th-congress/house-bill/10915",
  "updatedAt": "2026-10-27T08:43:36Z",
  "introducedAt": "2026-10-26"
}